{
  "timestamp": "2025-12-01T17:11:49.634Z",
  "overall": 76,
  "grade": "C",
  "principles": {
    "observability": {
      "score": 92,
      "grade": "A",
      "weight": 15
    },
    "controllability": {
      "score": 85,
      "grade": "B",
      "weight": 15
    },
    "algorithmicSimplicity": {
      "score": 75,
      "grade": "C",
      "weight": 10
    },
    "algorithmicTransparency": {
      "score": 60,
      "grade": "D",
      "weight": 10
    },
    "explainability": {
      "score": 75,
      "grade": "C",
      "weight": 10
    },
    "similarity": {
      "score": 85,
      "grade": "B",
      "weight": 5
    },
    "algorithmicStability": {
      "score": 70,
      "grade": "C",
      "weight": 10
    },
    "unbugginess": {
      "score": 55,
      "grade": "F",
      "weight": 10
    },
    "smallness": {
      "score": 90,
      "grade": "A",
      "weight": 10
    },
    "decomposability": {
      "score": 50,
      "grade": "F",
      "weight": 5
    }
  },
  "recommendations": [],
  "metadata": {
    "url": "https://studio.scaledagile.com/en/unauthenticated",
    "browser": "chromium",
    "version": "1.0.0",
    "assessor": "testability-scorer-skill",
    "duration": 28415
  }
}